root@mininet-vm:~# tcpdump
tcpdump: verbose output suppressed, use -v or -vv for full protocol decode
listening on h1-eth0, link-type EN10MB (Ethernet), capture size 65535 bytes
07:58:39.189996 IP 10.0.0.1 > 10.0.0.5: ICMP echo request, id 22134, seq 1, length 64
07:58:39.203027 IP 10.0.0.5 > 10.0.0.1: ICMP echo reply, id 22134, seq 1, length 64
07:58:44.247564 ARP, Request who-has 10.0.0.1 tell 10.0.0.5, length 28
07:58:44.247578 ARP, Reply 10.0.0.1 is-at 00:00:00:00:00:01 (oui Ethernet), length 28
^C
4 packets captured
4 packets received by filter
0 packets dropped by kernel
root@mininet-vm:~# 