root@mininet-vm:~# tcpdump
tcpdump: verbose output suppressed, use -v or -vv for full protocol decode
listening on h1-eth0, link-type EN10MB (Ethernet), capture size 65535 bytes
07:56:27.083316 IP 10.0.0.1 > 10.0.0.4: ICMP echo request, id 22098, seq 1, length 64
07:56:27.098342 IP 10.0.0.4 > 10.0.0.1: ICMP echo reply, id 22098, seq 1, length 64
07:56:32.145185 ARP, Request who-has 10.0.0.1 tell 10.0.0.4, length 28
07:56:32.145197 ARP, Reply 10.0.0.1 is-at 00:00:00:00:00:01 (oui Ethernet), length 28
^C
4 packets captured
4 packets received by filter
0 packets dropped by kernel
root@mininet-vm:~# 