root@mininet-vm:~# tcpdump
tcpdump: verbose output suppressed, use -v or -vv for full protocol decode
listening on h1-eth0, link-type EN10MB (Ethernet), capture size 65535 bytes
07:54:02.882103 IP 10.0.0.1 > 10.0.0.2: ICMP echo request, id 22060, seq 1, length 64
07:54:02.919121 IP 10.0.0.2 > 10.0.0.1: ICMP echo reply, id 22060, seq 1, length 64
07:54:07.882546 ARP, Request who-has 10.0.0.2 tell 10.0.0.1, length 28
07:54:07.899004 ARP, Reply 10.0.0.2 is-at 00:00:00:00:00:02 (oui Ethernet), length 28
^C
4 packets captured
4 packets received by filter
0 packets dropped by kernel
root@mininet-vm:~# 